{
  "$schema": "https://json-schema.org/draft/2020-12/schema",
  "$id": "https://ricotaarcade.local/schema/quiz/1",
  "title": "CTR-02 — Banco del quiz",
  "type": "object",
  "additionalProperties": false,
  "required": ["contrato", "contratoVersion", "juego", "actualizado", "items"],
  "properties": {
    "contrato": { "const": "CTR-02" },
    "contratoVersion": { "const": 1 },
    "juego": { "const": "quiz" },
    "actualizado": { "type": "string", "pattern": "^\\d{4}-\\d{2}-\\d{2}$" },
    "items": {
      "type": "array",
      "minItems": 1,
      "items": { "$ref": "#/$defs/item" }
    }
  },
  "$defs": {
    "item": {
      "type": "object",
      "additionalProperties": false,
      "required": [
        "id", "us", "categoria", "dificultad", "enunciado",
        "opciones", "explicacion", "esLeyenda", "sensibleA", "estado"
      ],
      "properties": {
        "id": { "type": "string", "pattern": "^QZ-\\d{3}$" },
        "us": {
          "type": "array", "minItems": 1,
          "items": { "type": "string", "pattern": "^US-\\d{2}$" }
        },
        "categoria": {
          "enum": ["historia", "discos", "letras", "mitologia"]
        },
        "dificultad": { "enum": ["facil", "media", "dificil"] },
        "enunciado": { "type": "string", "minLength": 10, "maxLength": 180 },
        "opciones": {
          "type": "array",
          "minItems": 4,
          "maxItems": 4,
          "items": { "$ref": "#/$defs/opcion" },
          "contains": {
            "type": "object",
            "required": ["correcta"],
            "properties": { "correcta": { "const": true } }
          },
          "minContains": 1,
          "maxContains": 1
        },
        "explicacion": { "type": "string", "minLength": 10, "maxLength": 400 },
        "fuentes": {
          "type": "array",
          "items": { "type": "string", "pattern": "^RES-\\d{2}$" }
        },
        "esLeyenda": { "type": "boolean" },
        "rotuloLeyenda": { "type": "string", "minLength": 10, "maxLength": 200 },
        "testimonio": { "$ref": "#/$defs/testimonio" },
        "sensibleA": {
          "type": "array",
          "uniqueItems": true,
          "items": { "enum": ["letra", "tapa", "audio"] }
        },
        "spotify": {
          "type": "object",
          "additionalProperties": false,
          "required": ["trackId"],
          "properties": {
            "trackId": { "type": "string", "pattern": "^[A-Za-z0-9]{22}$" }
          }
        },
        "estado": { "enum": ["borrador", "listo", "retirado"] },
        "notaInterna": { "type": "string" }
      },
      "allOf": [
        {
          "if": {
            "required": ["esLeyenda"],
            "properties": { "esLeyenda": { "const": false } }
          },
          "then": {
            "required": ["fuentes"],
            "properties": { "fuentes": { "minItems": 1 } }
          }
        },
        {
          "if": {
            "required": ["esLeyenda"],
            "properties": { "esLeyenda": { "const": true } }
          },
          "then": { "required": ["rotuloLeyenda"] }
        },
        {
          "if": { "required": ["testimonio"] },
          "then": {
            "required": ["fuentes"],
            "properties": {
              "esLeyenda": { "const": false },
              "fuentes": { "minItems": 1 }
            }
          }
        },
        {
          "if": {
            "required": ["testimonio"],
            "properties": {
              "testimonio": {
                "required": ["obra"],
                "properties": {
                  "obra": { "const": "Recuerdos que mienten un poco" }
                }
              }
            }
          },
          "then": {
            "required": ["fuentes"],
            "properties": {
              "fuentes": { "contains": { "const": "RES-21" } }
            }
          }
        },
        {
          "if": { "required": ["testimonio"] },
          "then": {
            "properties": {
              "enunciado": {
                "pattern": "(cont(ó|aba|aron)|[Cc]uenta|[Ss]egún|memorias|[Rr]ecuerda|[Rr]ecordó|[Dd]ice|[Dd]ijo|[Ss]ostiene|[Ss]ostuvo|[Aa]dmite|[Aa]dmitió|[Nn]iega|[Nn]egó|[Aa]clara|[Aa]claró|[Ee]l propio|[Ll]a propia)"
              }
            }
          }
        }
      ]
    },
    "testimonio": {
      "type": "object",
      "additionalProperties": false,
      "required": ["quien", "obra", "ubicacion", "afirmacion"],
      "properties": {
        "quien": {
          "type": "string",
          "minLength": 6,
          "maxLength": 60,
          "pattern": "^[A-ZÁÉÍÓÚÑ]"
        },
        "obra": { "enum": ["Recuerdos que mienten un poco"] },
        "ubicacion": {
          "type": "string",
          "maxLength": 100,
          "pattern": "^((cap\\. \\d{1,2}( «[^»]{3,80}»)?|comentario de «[^»]{3,60}»)(, pp?\\. \\d{1,4}(-\\d{1,4})?)?|pp?\\. \\d{1,4}(-\\d{1,4})?)$"
        },
        "afirmacion": {
          "type": "string",
          "minLength": 40,
          "maxLength": 300,
          "pattern": "^(Cuenta|Recuerda|Dice|Sostiene|Afirma|Niega|Aclara|Admite|Reconoce|Describe|Explica|Atribuye|Define|Detalla|Relata|Asegura) (que|cómo|por qué) \\S"
        }
      }
    },
    "opcion": {
      "type": "object",
      "additionalProperties": false,
      "required": ["texto", "correcta"],
      "properties": {
        "texto": { "type": "string", "minLength": 1, "maxLength": 60 },
        "correcta": { "type": "boolean" },
        "nota": { "type": "string", "maxLength": 200 }
      }
    }
  }
}
