{
  "contrato": "CTR-02",
  "contratoVersion": 1,
  "juego": "quiz",
  "actualizado": "2026-10-01",
  "items": [
    {
      "id": "QZ-001",
      "us": [
        "US-01"
      ],
      "categoria": "discos",
      "dificultad": "media",
      "enunciado": "¿En qué año salió Gulp!, el primer disco de estudio de la banda?",
      "opciones": [
        {
          "texto": "1983",
          "correcta": false
        },
        {
          "texto": "1985",
          "correcta": true
        },
        {
          "texto": "1988",
          "correcta": false
        },
        {
          "texto": "1991",
          "correcta": false
        }
      ],
      "explicacion": "Gulp! salió en 1985. Es el debut en disco, aunque la banda ya venía tocando con ese nombre desde 1977.",
      "fuentes": [
        "RES-02"
      ],
      "esLeyenda": false,
      "sensibleA": [],
      "estado": "listo",
      "notaInterna": "Ciclo 9: la explicacion nombraba el sello Wormo, que es exactamente lo que pregunta QZ-003. QZ-001 es media y QZ-003 dificil, asi que BR-01 lo sirve primero y regalaba el otro. Se saca el sello."
    },
    {
      "id": "QZ-002",
      "us": [
        "US-01"
      ],
      "categoria": "discos",
      "dificultad": "facil",
      "enunciado": "¿Cómo se llama el disco que la banda editó en 1986, un año después de Gulp!?",
      "opciones": [
        {
          "texto": "Oktubre",
          "correcta": true
        },
        {
          "texto": "Un baión para el ojo idiota",
          "correcta": false
        },
        {
          "texto": "¡Bang! ¡Bang!... Estás liquidado",
          "correcta": false
        },
        {
          "texto": "La mosca y la sopa",
          "correcta": false
        }
      ],
      "explicacion": "Oktubre salió el 4 de octubre de 1986, un año y medio después del debut.",
      "fuentes": [
        "RES-02"
      ],
      "esLeyenda": false,
      "sensibleA": [],
      "estado": "listo",
      "notaInterna": "Ciclo 9: la explicacion nombraba los sellos y eso achicaba QZ-003 (dificil, sale despues) de cuatro opciones a dos. Se sacan los sellos."
    },
    {
      "id": "QZ-003",
      "us": [
        "US-01"
      ],
      "categoria": "discos",
      "dificultad": "dificil",
      "enunciado": "¿Qué sello editó Gulp!, el debut de la banda en 1985?",
      "opciones": [
        {
          "texto": "Wormo",
          "correcta": true
        },
        {
          "texto": "Del Cielito",
          "correcta": false
        },
        {
          "texto": "Patricio Rey Discos",
          "correcta": false
        },
        {
          "texto": "Interdisc",
          "correcta": false
        }
      ],
      "explicacion": "Gulp! salió en 1985 por Wormo, un sello chico. Del Cielito llegó después, y el sello propio recién en 1998.",
      "fuentes": [
        "RES-02"
      ],
      "esLeyenda": false,
      "sensibleA": [],
      "estado": "listo",
      "notaInterna": "Ciclo 9: «Sony Music» era distractor muerto — una multinacional no encaja con la autogestión de RES-07, así que se descartaba sin saber nada. Se reemplaza por Interdisc. Sube a dificil: el sello del debut no lo sabe un fan casual."
    },
    {
      "id": "QZ-004",
      "us": [
        "US-01"
      ],
      "categoria": "discos",
      "dificultad": "facil",
      "enunciado": "¿Cuál de estos discos se editó como álbum doble, con sus dos volúmenes el mismo día?",
      "opciones": [
        {
          "texto": "Lobo suelto, cordero atado",
          "correcta": true
        },
        {
          "texto": "La mosca y la sopa",
          "correcta": false
        },
        {
          "texto": "Último bondi a Finisterre",
          "correcta": false
        },
        {
          "texto": "Un baión para el ojo idiota",
          "correcta": false
        }
      ],
      "explicacion": "Lobo suelto, cordero atado salió en 1993 como álbum doble: volumen 1 y volumen 2 el mismo día, cada uno con su propia tapa.",
      "fuentes": [
        "RES-02"
      ],
      "esLeyenda": false,
      "sensibleA": [],
      "estado": "listo",
      "notaInterna": "Ciclo 9, dificultad: baja de media a facil. Es el item mas facil de discos y por un motivo estructural — «Lobo suelto, cordero atado» es el unico titulo partido en dos de la lista, asi que la forma del titulo ya sugiere el disco doble. Etiquetarlo facil dice la verdad sobre lo que pide. Ademas hacia falta un tercer facil fuera de mitologia: BR-01 abre toda partida con un facil, y hasta este ciclo la mitad de esos faciles eran de mitologia, con lo cual casi toda partida arrancaba con una leyenda. Ademas se saca el sello de la explicacion: achicaba QZ-008."
    },
    {
      "id": "QZ-005",
      "us": [
        "US-01"
      ],
      "categoria": "discos",
      "dificultad": "dificil",
      "enunciado": "¿Cuál fue el primer disco que la banda editó bajo su propio sello, Patricio Rey Discos?",
      "opciones": [
        {
          "texto": "Último bondi a Finisterre",
          "correcta": true
        },
        {
          "texto": "Momo Sampler",
          "correcta": false
        },
        {
          "texto": "Luzbelito",
          "correcta": false
        },
        {
          "texto": "Lobo suelto, cordero atado",
          "correcta": false
        }
      ],
      "explicacion": "Último bondi a Finisterre, de 1998, fue el primero por Patricio Rey Discos, el sello propio. Luzbelito generaba dudas y se confirmó que salió por Del Cielito. Momo Sampler repitió el sello propio después.",
      "fuentes": [
        "RES-02",
        "RES-20"
      ],
      "esLeyenda": false,
      "sensibleA": [],
      "estado": "listo",
      "notaInterna": "Ciclo 9: se saca «(2000)» de la explicación, que regalaba entera la respuesta de QZ-006."
    },
    {
      "id": "QZ-006",
      "us": [
        "US-01"
      ],
      "categoria": "discos",
      "dificultad": "media",
      "enunciado": "¿En qué año salió Momo Sampler, el disco que cierra la lista de estudio de la banda?",
      "opciones": [
        {
          "texto": "1998",
          "correcta": false
        },
        {
          "texto": "2000",
          "correcta": true
        },
        {
          "texto": "2001",
          "correcta": false
        },
        {
          "texto": "1996",
          "correcta": false
        }
      ],
      "explicacion": "Momo Sampler salió en el año 2000, editado por Patricio Rey Discos.",
      "fuentes": [
        "RES-02"
      ],
      "esLeyenda": false,
      "sensibleA": [],
      "estado": "listo"
    },
    {
      "id": "QZ-007",
      "us": [
        "US-01"
      ],
      "categoria": "discos",
      "dificultad": "facil",
      "enunciado": "¿Cuál de estos discos salió en 1988?",
      "opciones": [
        {
          "texto": "Un baión para el ojo idiota",
          "correcta": true
        },
        {
          "texto": "¡Bang! ¡Bang!... Estás liquidado",
          "correcta": false
        },
        {
          "texto": "La mosca y la sopa",
          "correcta": false
        },
        {
          "texto": "Luzbelito",
          "correcta": false
        }
      ],
      "explicacion": "Un baión para el ojo idiota salió en 1988, tres años después del debut.",
      "fuentes": [
        "RES-02"
      ],
      "esLeyenda": false,
      "sensibleA": [],
      "estado": "listo",
      "notaInterna": "Ciclo 9, dos fugas. Una: el enunciado decia «dos años después de Oktubre», y 1988 menos dos es 1986, que es la respuesta de QZ-002 — los dos son faciles, asi que podian salir en cualquier orden. Dos: la explicacion atribuia el disco al sello Wormo, que es la respuesta de QZ-003. Ojo con ese sello: RES-02 dice Wormo y RES-20 dice Del Cielito para este disco. La contradiccion queda abierta para investigador; mientras tanto el sello no se afirma en texto visible."
    },
    {
      "id": "QZ-008",
      "us": [
        "US-01"
      ],
      "categoria": "discos",
      "dificultad": "media",
      "enunciado": "¿Qué sello editó La mosca y la sopa, el disco de 1991?",
      "opciones": [
        {
          "texto": "Wormo",
          "correcta": false
        },
        {
          "texto": "Del Cielito",
          "correcta": true
        },
        {
          "texto": "Patricio Rey Discos",
          "correcta": false
        },
        {
          "texto": "Interdisc",
          "correcta": false
        }
      ],
      "explicacion": "La mosca y la sopa salió por Del Cielito, el sello que acompañó a la banda desde Oktubre hasta Luzbelito.",
      "fuentes": [
        "RES-02"
      ],
      "esLeyenda": false,
      "sensibleA": [],
      "estado": "listo",
      "notaInterna": "Ciclo 9: la explicacion decia «salió en 1991» y eso, junto con el 1989 que da el enunciado de QZ-009, contesta QZ-009 sin saber la discografia. Los dos son media, asi que el orden no protege. Se saca el año."
    },
    {
      "id": "QZ-009",
      "us": [
        "US-01"
      ],
      "categoria": "discos",
      "dificultad": "media",
      "enunciado": "En el orden de la discografía, ¿qué disco salió justo después de ¡Bang! ¡Bang!... Estás liquidado (1989)?",
      "opciones": [
        {
          "texto": "Un baión para el ojo idiota",
          "correcta": false
        },
        {
          "texto": "La mosca y la sopa",
          "correcta": true
        },
        {
          "texto": "Lobo suelto, cordero atado",
          "correcta": false
        },
        {
          "texto": "Luzbelito",
          "correcta": false
        }
      ],
      "explicacion": "Después de ¡Bang! ¡Bang!... Estás liquidado (1989) llegó La mosca y la sopa, en 1991.",
      "fuentes": [
        "RES-02"
      ],
      "esLeyenda": false,
      "sensibleA": [],
      "estado": "listo"
    },
    {
      "id": "QZ-010",
      "us": [
        "US-01"
      ],
      "categoria": "discos",
      "dificultad": "dificil",